	index	genre	filename	year	old_index	source1	source2	sentence1	sentence2	score
328	328	main-captions	MSRvid	2012test	492	none	none	An airplane is flying in the air.	A South African Airways plane is flying in a blue sky.	3.4
1509	1509	main-captions	images	2015	34	none	none	A man crouching and holding a camera.	The crouching man is holding a large camera.	4.6
3068	3094	main-news	MSRpar	2012train	213	none	none	This has been a persistent problem that has not been solved, investigation board member Steven Wallace said.	This was a persistent problem which has not been solved, mechanically and physically, said board member Steven Wallace.	4.0
4147	4190	main-news	headlines	2013	549	none	none	ArQule, Daiichi stop lung cancer trial, shares tank	ArQule stock plunges as lung cancer study shelved	3.4
3664	3707	main-news	deft-news	2014	257	none	none	the meeting was 3 days long.	the meetings lasted 2 days.	2.8
3184	3210	main-news	MSRpar	2012train	409	none	none	Shiites make up 20 percent of the country's population.	Sunnis make up 77 percent of Pakistan's population, Shiites 20 percent.	3.0
5128	5171	main-news	headlines	2015	544	none	none	World's oldest person dies in Japan at 116	Jiroemon Kimura: World's oldest person dies aged 116	4.8
5525	5568	main-news	headlines	2016	142	Europe Media Monitor (http://emm.newsbrief.eu)	Europe Media Monitor (http://emm.newsbrief.eu)	Egypt protesters defy cabinet threat to end sit-ins	Egypt protesters defy cabinet threat	4.0
5290	5333	main-news	headlines	2015	940	none	none	Puerto Rican arrested for production of child pornography	Indian guru arrested on suspicion of rape	0.4
3529	3572	main-news	deft-news	2014	122	none	none	indian troops already fighting rebels in kashmir are now engaged in a massive campaign to destroy poppy crops in the region.	indian troops already fighting rebels are now also engaged in a massive operation to destroy poppy crops in kashmir.	5.0
3821	3864	main-news	headlines	2013	143	none	none	Chicago teachers strike: Vacations for students, for good or ill	Chicago teacher strike poses test for unions	2.2
3946	3989	main-news	headlines	2013	297	none	none	Romney, Obama fight for edge on Medicare	Obama, Romney compete for undecideds, stoke base	1.0
3774	3817	main-news	headlines	2013	86	none	none	Suspected al-Qaeda financier arrested in France	Three al Qaeda suspects arrested in Spain	1.6
3466	3509	main-news	deft-news	2014	59	none	none	kashmir is divided between india and pakistan.	kashmir is claimed by both india and pakistan.	4.4
809	809	main-captions	MSRvid	2012train	467	none	none	A man is doing a card trick.	A man is squeezing water.	0.25
3250	3277	main-news	MSRpar	2012train	503	none	none	The case comes out of Illinois and involves a for-profit company called Telemarketing Associates Inc.	The case decided Monday centered around an Illinois fund-raiser, Telemarketing Associates.	4.4
5424	5467	main-news	headlines	2015	1290	none	none	Indian army kill 3 militants in Indian-controlled Kashmir	Indian troops kill militant commander in Indian-controlled Kashmir	3.6
3861	3904	main-news	headlines	2013	192	none	none	Romney wins Maine Republican caucuses	Romney, in comeback, has narrow Maine caucus win	3.8
1473	1473	main-captions	images	2014	711	none	none	A boat is on the water near a small plane.	A boat is in the water and a small airplane is on the dock.	3.4
2574	2583	main-news	MSRpar	2012test	219	none	none	The broader Standard & Poor's 500 Index <.SPX> was up 9.69 points, or 0.98 percent, at 994.53.	The tech-laced Nasdaq Composite Index <.IXIC> gained 18.35 points, or 1.13 percent, to 1,646.02.	1.0
3249	3276	main-news	MSRpar	2012train	502	none	none	It's very difficult to do large syndicated loans in Japan, where there is a lack of expertise, says one banker.	It is very difficult to do large syndicated loans in Japan, says one banker.	3.8
5338	5381	main-news	headlines	2015	1058	none	none	Obama condemns killing of 3 Israeli teens	Bodies of missing Israeli teens found in West Bank	1.4
1415	1415	main-captions	images	2014	617	none	none	Long-haired black dog standing in grassy field.	A blue jay standing in a grassy field.	1.4
4430	4473	main-news	headlines	2014	157	none	none	2 car bombs kill 8 in southern Iraq	Car bombing kills 14 in northern Iraq	1.4
1602	1602	main-captions	images	2015	324	none	none	A blond haired lady in white poses for the camera.	A black and white dog runs with its mouth open.	0.0
4545	4588	main-news	headlines	2014	297	none	none	Meteorite hits central Russia, more than 500 people hurt	Meteorite hits central Russia, 400 hurt	3.0
1359	1359	main-captions	images	2014	529	none	none	A group of people sitting at a restaurant table.	A group of people sitting around a table on a porch.	2.6
3588	3631	main-news	deft-news	2014	181	none	none	international atomic energy association is the united nations watchdog.	the international atomic energy agency is the u.n.'s nuclear watchdog.	5.0
5553	5596	main-news	headlines	2016	366	Europe Media Monitor (http://emm.newsbrief.eu)	Europe Media Monitor (http://emm.newsbrief.eu)	U.S. and Russia reach a deal on Syria's chemical weapons	China welcomes US, Russia deal on Syria chemical weapons	3.0
1829	1829	main-captions	images	2015	1007	none	none	The black and white dog runs through the grass.	A black and white dog is running through grass.	5.0
1155	1155	main-captions	images	2014	225	none	none	Two red buses parked up with gardens in front of them.	Red buses are parked by a large white building beside a formal garden.	3.4
3017	3041	main-news	MSRpar	2012train	124	none	none	The findings appear in Wednesday's Journal of the American Medical Association (news - web sites).	The results are to be published in Wednesday's issue of The Journal of the American Medical Association.	3.5
4433	4476	main-news	headlines	2014	160	none	none	China stock index futures close higher -- Dec. 4	China stock index futures close lower -- Jan. 24	2.2
895	895	main-captions	MSRvid	2012train	592	none	none	A dog is opening a fridge.	A dog closes a refrigerator door.	1.75
2254	2257	main-forum	deft-forum	2014	257	none	none	My best, Kutte My ex-fiance wouldn't use the VA or Navy doctor's.	Jay My ex-fiance wouldn't use the VA or Navy doctor's.	3.6
2487	2490	main-news	MSRpar	2012test	68	none	none	Shares of Hartford rose $2.88 to $46.50 in New York Stock Exchange composite trading.	Shares of Hartford were up $2.28, or 5.2 percent, to $45.90 in midday trading.	2.5
2239	2242	main-forum	deft-forum	2014	242	none	none	It's a common sense/deductive reasoning thing.	Hilited your common sense/deductive reasoning thing.	2.5
135	135	main-captions	MSRvid	2012test	199	none	none	The puppy played with a blue tennis ball.	A puppy is playing with a tennis ball.	4.0
4548	4591	main-news	headlines	2014	301	none	none	'Credibility on the line over Syria'	Obama: Congress, world credibility on line	1.4
5658	5701	main-news	headlines	2016	1174	Europe Media Monitor (http://emm.newsbrief.eu)	Europe Media Monitor (http://emm.newsbrief.eu)	Egypt: IPI Urges Release of Al Jazeera Journalist Arrested in Berlin	Egypt sentences Al Jazeera journalists to jail	1.0
1563	1563	main-captions	images	2015	220	none	none	A brown and black dog is jumping to catch a red ball.	A brown and black dog jumps for a red ball.	5.0
2729	2753	main-news	MSRpar	2012test	458	none	none	So far, Georgia has been returned all but $70,000 of the money it wired.	Georgia has received all but $70,000 of its money back with the help of the FBI.	3.75
2497	2500	main-news	MSRpar	2012test	81	none	none	After protesters rushed the stage and twice cut power to the microphone, Hedges drew the speech to an early close.	After protesters rushed the stage and twice cut power to the microphone, Hedges cut his speech short.	5.0
5133	5176	main-news	headlines	2015	560	none	none	News of Terrorism and the Israeli-Palestinian Conflict (January 22 ‚Äď 28, 2014)	News of Terrorism and the Israeli-Palestinian Conflict (July 31 ‚Äď August 6, 2013)	3.0
5378	5421	main-news	headlines	2015	1167	none	none	Peace talks with Palestinians would take months: Israel official	3yo Palestinian girl killed in Israeli raid	0.4
107	107	main-captions	MSRvid	2012test	157	none	none	The lady chopped up the green onions.	The lady cut up a green onion.	4.8
5038	5081	main-news	headlines	2015	312	none	none	James Gandolfini dies aged 51	Nelson Mandela dies aged 95	0.4
54	54	main-captions	MSRvid	2012test	80	none	none	A woman is slicing an onion.	A man is cutting and onion.	3.2
1820	1820	main-captions	images	2015	979	none	none	A dog in the snow.	Two dogs in snow.	3.0
1290	1290	main-captions	images	2014	428	none	none	Three people sitting at dinner table smiling at camera.	Two elderly women sit at a dinner table with a man.	2.0
5403	5446	main-news	headlines	2015	1232	none	none	Boston bombing suspect to appear in court	Boston bombing suspect buried	1.2
467	467	main-captions	MSRvid	2012test	705	none	none	A cat is drinking some water.	A truck is going down a hill.	0.0
4150	4193	main-news	headlines	2013	552	none	none	2 Americans Killed as Afghan Unrest Enters Fifth Day	Two American Officers Murdered As Afghan Unrest Continues	4.2
932	932	main-captions	MSRvid	2012train	642	none	none	A car backs out of a space.	A car is taking reverse.	2.4
5601	5644	main-news	headlines	2016	776	Europe Media Monitor (http://emm.newsbrief.eu)	Europe Media Monitor (http://emm.newsbrief.eu)	US to Determine Extent of Chemical Weapons Use by Syria	What we know so far about chemical weapons in Syria's civil war	2.0
957	957	main-captions	MSRvid	2012train	685	none	none	Someone is holding and petting a baby tiger.	Someone is rinsing a large beef steak at the kitchen sink.	0.4
4191	4234	main-news	headlines	2013	605	none	none	Canadian Muslims issue fatwa against 'honor killing'	US, Canadian imams issue fatwa against honour killings	3.4
1154	1154	main-captions	images	2014	223	none	none	Plane in mid-flight at sunset.	A plane flying near the sunset.	3.8
2083	2086	main-forum	deft-forum	2014	86	none	none	that is not an answer.	no, it's not an answer.	4.8
2003	2006	main-forum	deft-forum	2014	6	none	none	I am OK with MEDICAL use!	I AM OK WITH MEDICAL USE!!	5.0
1413	1413	main-captions	images	2014	614	none	none	A bicycle is parked by a shop.	A green bike parked outside a book store.	3.8
1452	1452	main-captions	images	2014	679	none	none	Two buses parked on a street.	Yellow scooter parked in an alley way.	0.4
3064	3088	main-news	MSRpar	2012train	204	none	none	The British Foreign Office said Monday that coalition authorities in Iraq were pleased that the men were freed.	The British Foreign Office said it had mediated the two men's release.	2.6
4740	4783	main-news	headlines	2014	542	none	none	Chinese court upholds death penalties for Mekong murderers	Court upholds death sentences for Mekong murderers	4.4
2140	2143	main-forum	deft-forum	2014	143	none	none	My parents have told me it is bad for you.	officers have told me its bad for you.	2.0
1351	1351	main-captions	images	2014	516	none	none	Train in a station.	Trains inside an indoor station.	3.8
349	349	main-captions	MSRvid	2012test	520	none	none	Butter is being put into a bowl.	A man cutting butter into a mixing bowl.	4.25
758	758	main-captions	MSRvid	2012train	374	none	none	Someone is cracking an egg open.	A man is breaking an egg.	3.0
4487	4530	main-news	headlines	2014	224	none	none	US warns Syria on chemical weapons	U.S. concerns grow about Syria's chemical weapons	3.2
154	154	main-captions	MSRvid	2012test	227	none	none	A man is slicing something.	A man is slicing a bun.	3.0
1341	1341	main-captions	images	2014	499	none	none	Two brunette girls sit atop a red an yellow motorcycle with a side car.	A couple posing on a red and yellow motorcycle.	3.2
2183	2186	main-forum	deft-forum	2014	186	none	none	h and i both read the books and thought the movie moved so quickly.	I haven't read the books, but I saw the movie today.	3.0
1221	1221	main-captions	images	2014	328	none	none	Three sheep on a dirt road viewed from a passenger vehicle.	Three sheep in middle of gravel road.	3.4
2063	2066	main-forum	deft-forum	2014	66	none	none	And yet, the Titanic story is the one that holds up to scrutiny of the evidence.	The new study shows that the Titanic story does not stand up to scrutiny imo.	1.6
4591	4634	main-news	headlines	2014	354	none	none	Gunmen kill one soldier, injure two others in Pakistan	Gunmen kill 6 polio workers in Pakistan	2.0
1470	1470	main-captions	images	2014	706	none	none	A yellow and black bird eats from a bird feeder.	A flock of birds flying over a body of water.	0.6
4744	4787	main-news	headlines	2014	546	none	none	Israeli forces detain 5 Palestinians in West Bank	Israeli Forces Arrest Five Palestinians across West Bank	4.8
1142	1142	main-captions	images	2014	206	none	none	Group of people sitting at table with drinks.	four people sitting at a table.	3.0
2774	2798	main-news	MSRpar	2012test	529	none	none	Previously he had seen the grinning mechanic from east Java only on television.	Mr Hughes had seen Amrozi's face on television, the infamous images of the grinning mechanic from east Java.	3.4
2898	2922	main-news	MSRpar	2012test	704	none	none	"Byrd, speaking from the Senate floor, said he questioned ""the motives of a deskbound president who assumes the garb of a warrior for purposes of a speech."""	But I do question the motives of a desk-bound president who assumes the garb of a warrior for the purposes of a speech.	3.4
3632	3675	main-news	deft-news	2014	225	none	none	according to the statement the rs-24 reinforces the military potential of the strategic forces to overcome anti-missile defense systems.	according to the statement the prototype rs-24 rocket is unlike the topol-m in that it is equipped with multiple independently targetable warheads to overwhelm defense systems.	3.2
1921	1921	main-captions	images	2015	1273	none	none	Two teenage girls, one is smiling.	A little girl on a kid swing.	0.8
728	728	main-captions	MSRvid	2012train	337	none	none	A woman puts slabs of meat in a pan.	A man puts pieces of meat into a plastic bag.	2.4
5169	5212	main-news	headlines	2015	652	none	none	South Korea Ferry Crew Members Stand Trial	Sewol ferry crew faces trial	4.4
1606	1606	main-captions	images	2015	337	none	none	A white dog runs through a field of yellow flowers.	A dog with a red collar runs in a forest in the middle of winter.	1.6
1281	1281	main-captions	images	2014	412	none	none	Two people sailing a small white sail boat.	Couple sailing in a small sailboat.	4.2
4057	4100	main-news	headlines	2013	434	none	none	Spanish bailout dilemma gets more acute	Spanish dilemma gets more acute	3.4
4019	4062	main-news	headlines	2013	388	none	none	8 rockets fired from Gaza into southern Israel; none hurt	Ten rockets from Gaza land in southern Israel; none hurt	3.4
2427	2430	main-forum	deft-forum	2014	430	none	none	This is not your country.	This is our country.	1.4
2875	2899	main-news	MSRpar	2012test	676	none	none	But Senate criticism of the House plan Tuesday came on several fronts.	And several Senate Republicans are cranky about the House map.	2.75
5464	5507	main-news	headlines	2015	1393	none	none	Chinese president meets Greek PM, calling for stronger partnership	Chinese president meets Indian vice president	1.8
3082	3108	main-news	MSRpar	2012train	240	none	none	The launch coincides with the JavaOne developers' conference in San Francisco this week.	The news also comes in conjunction with Suns annual JavaOne developers conference in San Francisco.	3.25
4648	4691	main-news	headlines	2014	422	none	none	Protests continue in tense Ukraine capital	Protests continue in Brazil	1.6
4854	4897	main-news	headlines	2014	681	none	none	Hollande 'threatens legal action' after affair allegations	François Hollande threatens legal action over affair claims	4.0
1939	1939	main-captions	images	2015	1325	none	none	A woman sits alone against a brick wall	A woman is walking with a red bag.	1.2
164	164	main-captions	MSRvid	2012test	241	none	none	A person is boiling noodles.	A woman is boiling noodles in water.	4.0
1534	1534	main-captions	images	2015	136	none	none	five people standing on a sidewalk	Five people on a sidewalk.	4.8
1059	1059	main-captions	images	2014	82	none	none	Three men are sitting down at a table that has drinks on it.	Three men sitting at the table with beer and food.	3.4
866	866	main-captions	MSRvid	2012train	545	none	none	A man  is driving a car.	A woman dips a shrimp in batter.	0.0
446	446	main-captions	MSRvid	2012test	672	none	none	A man is cutting bread.	A man is doing tricks with a soccer ball.	1.0
3875	3918	main-news	headlines	2013	206	none	none	Two NATO soldiers killed in Afghanistan	NATO Soldier Killed in Afghan Blast	3.6
3817	3860	main-news	headlines	2013	139	none	none	UN security council orders global sanctions against Haqqani network in Afghanistan	UN orders global sanctions against Haqqani network	4.4
4612	4655	main-news	headlines	2014	375	none	none	Israeli soldier hits Palestinian child in Hebron	Israeli soldiers kill Palestinian woman in West Bank	1.2
2356	2359	main-forum	deft-forum	2014	359	none	none	Jake with the assist.	Voracek with the goal.	0.4
5406	5449	main-news	headlines	2015	1239	none	none	Five charged with terrorism offences	Five People Charged With Terror Offences	4.8
3163	3189	main-news	MSRpar	2012train	377	none	none	Russin did not comment; his lawyer did not attend the hearing and did not return phone messages.	His lawyer, a cousin, Basil Russin, did not attend the hearing and did not return phone messages.	3.4
2002	2005	main-forum	deft-forum	2014	5	none	none	go figure You're asking me to prove a negative?	You're asking me to prove a negative?	4.6
4767	4810	main-news	headlines	2014	575	none	none	Blast kills 10 young girls in eastern Afghanistan	Blast kills nine in southern Afghanistan: officials	2.8
5412	5455	main-news	headlines	2015	1264	none	none	Philip leaves hospital after 11 days	Mandela leaves hospital after 10 days	1.8
5498	5541	main-news	headlines	2015	1478	none	none	Italy bus crash death toll rises	Starbucks clears college degree path for workers	0.0
275	275	main-captions	MSRvid	2012test	409	none	none	A woman is taking a shower.	A man is riding a white horse.	0.0
1751	1751	main-captions	images	2015	767	none	none	A young girl doing a back flip in the water.	a young girl wearing purple running through water	2.8
4416	4459	main-news	headlines	2014	141	none	none	Wave of bombings kills 15 in Iraq	Car bombs kill at least 49 in Iraq	2.2
3204	3230	main-news	MSRpar	2012train	435	none	none	Wells’ other series include NBC’s ER and Third Watch.	"Wells' other series include NBC's ""ER"" and ""Third Watch."""	5.0
45	45	main-captions	MSRvid	2012test	68	none	none	A man is playing the piano.	A woman is playing the violin.	1.0
2091	2094	main-forum	deft-forum	2014	94	none	none	Iran is also a signed of the NPT and the IAEA.	"Gotta love the EK factoid that ""Iran is also a signed of the NPT and the IAEA."	4.2
5508	5551	main-news	headlines	2015	1499	none	none	Obama made last-minute decision on Syria approval	Obama mulls limited military action in Syria	2.0
2777	2801	main-news	MSRpar	2012test	533	none	none	Biotech products, if anything, may be safer than conventional products because of all the testing, Fraley said, adding that 18 countries have adopted biotechnology.	Biotech products, if anything, may be safer than conventional products because of all the testing, said Robert Fraley, Monsanto's executive vice president.	3.2
5569	5612	main-news	headlines	2016	495	Europe Media Monitor (http://emm.newsbrief.eu)	Europe Media Monitor (http://emm.newsbrief.eu)	Saudi man with pressure cooker arrested at Detroit airport	Saudi Man Traveling With Pressure Cooker Arrested	4.0
1707	1707	main-captions	images	2015	628	none	none	A black dog wearing an orange collar is entangled with fishing wire.	The black dog wearing a red collar shakes water off.	1.8
4625	4668	main-news	headlines	2014	392	none	none	Malaysia's long-ruling coalition hangs on to power	Malaysia's ruling coalition wins majority	3.8
1754	1754	main-captions	images	2015	774	none	none	A small boy in a bathrobe is sitting in a metal chair.	A boy in a robe sits in a chair.	4.2
2177	2180	main-forum	deft-forum	2014	180	none	none	Tell us what the charges were.	Yes what are his charges.	4.0
5505	5548	main-news	headlines	2015	1493	none	none	Assad says Syria will comply with UN arms resolution	Syria's Assad vows to comply with U.N. resolution	4.8
397	397	main-captions	MSRvid	2012test	600	none	none	A man is walking with a horse.	A man is leading a horse around by it's halter.	3.75
485	485	main-captions	MSRvid	2012test	736	none	none	Four boys are standing in front of the burning car.	Four young men stand still as a car explodes behind them.	3.75
429	429	main-captions	MSRvid	2012test	642	none	none	The woman is pencilling on eye shadow.	The girl is using an eye pencil on her eyelid.	2.8
3446	3489	main-news	deft-news	2014	39	none	none	no other drug has become as integral in decades.	the drug has been around in other forms for years.	2.0
3780	3823	main-news	headlines	2013	93	none	none	Rebel fighters 'capture' Syrian soldiers	Free Syrian Army captures Syrian officers	3.2
5507	5550	main-news	headlines	2015	1498	none	none	Food price hikes raise concerns in Iran	American Chris Horner wins Tour of Spain	0.0
3929	3972	main-news	headlines	2013	276	none	none	Florida counties extend early voting	Fla. Democrats want extended early voting hours	2.8
2659	2674	main-news	MSRpar	2012test	353	none	none	Shares of San Diego-based Jack In The Box closed at $21.49, up 78 cents, or 3.8 percent, on the New York Stock Exchange.	Shares of Tampa-based Outback Steakhouse Inc. closed at $44.50, up $1.78, or 4.2 percent, on the New York Stock Exchange.	1.6
1711	1711	main-captions	images	2015	645	none	none	a man in red shorts is walking along rocks by a river carrying a stick.	A man is walking on rocks with water flowing around them.	3.4
1615	1615	main-captions	images	2015	362	none	none	A dog is running toward the camera.	A brown and white dog running on grass.	0.8
186	186	main-captions	MSRvid	2012test	274	none	none	An orangutan is riding a bus.	A monkey is riding on a bus.	3.6
4816	4859	main-news	headlines	2014	633	none	none	26 Palestinian prisoners released from Israeli prison	Palestinian prisoner dies of cancer, unrest in Israel jails	1.0
657	657	main-captions	MSRvid	2012train	240	none	none	A motorcyclist crashes on his motorcycle.	A person crashes on a motorcycle.	4.2
4676	4719	main-news	headlines	2014	459	none	none	New World Trade Center declared tallest building in U.S.	One World Trade Center Named Tallest US Building	4.2
5454	5497	main-news	headlines	2015	1373	none	none	Wave of attacks kills at least 95 in Iraq	Suicide attack kills at least 12 in northern Iraq	1.8
3209	3235	main-news	MSRpar	2012train	442	none	none	The department ordered an 18.2 percent reduction for Allstate Texas Lloyds and a 12 percent reduction for State Farm Lloyds.	The department ordered a 12 percent reduction for State Farm Lloyds, the state's largest insurer, and an 18.2 percent reduction for Allstate Texas Lloyds, the third-largest.	3.6
808	808	main-captions	MSRvid	2012train	462	none	none	A boy is riding a bike on a gate.	A woman is riding a horse.	0.8
5678	5721	main-news	headlines	2016	1294	Europe Media Monitor (http://emm.newsbrief.eu)	Europe Media Monitor (http://emm.newsbrief.eu)	Plane Crash Site Search Called off for the Night	Tour De France Pack Sets off for Stage 15	0.0
933	933	main-captions	MSRvid	2012train	644	none	none	A man is holding a frog.	A man is emptying a plastic container.	0.6
1814	1814	main-captions	images	2015	954	none	none	The boy is looking up at the girl as another girl ignores them.	the boy is diving into the pool as the couple watch.	0.2
720	720	main-captions	MSRvid	2012train	322	none	none	An airplane moves along a runway.	A plane is landing on a runway.	2.8
1638	1638	main-captions	images	2015	430	none	none	a woman playing with two young boys at a park	A woman and three kids play at a park.	3.2
1173	1173	main-captions	images	2014	251	none	none	A girl in riding gear sits atop a brown horse.	A girl in a red shirt is riding a brown horse.	4.0
3972	4015	main-news	headlines	2013	330	none	none	Highlights of the Vice Presidential debate	Five things to watch in the presidential debate	2.2
4562	4605	main-news	headlines	2014	319	none	none	US drone strike kills three in northwest Pakistan	US drone strike kills seven in North Waziristan	2.4
5578	5621	main-news	headlines	2016	584	Europe Media Monitor (http://emm.newsbrief.eu)	Europe Media Monitor (http://emm.newsbrief.eu)	N. Korea Deports Elderly American	North Korea deports detained US war veteran	2.0
2068	2071	main-forum	deft-forum	2014	71	none	none	"What is your definition of ""life""?"	What's your definition of nature?	1.2
3988	4031	main-news	headlines	2013	349	none	none	AL renews condemnation on Syria's violence	U.S. closes embassy in Damascus due to Syria violence	1.6
522	522	main-captions	MSRvid	2012train	48	none	none	A man is playing a flute.	A man is playing a guitar.	2.0
2397	2400	main-forum	deft-forum	2014	400	none	none	Your confusion doesn't make me a liar.	Then your confusion doesn't make me a liar either.	3.8
5556	5599	main-news	headlines	2016	377	Europe Media Monitor (http://emm.newsbrief.eu)	Europe Media Monitor (http://emm.newsbrief.eu)	Police helicopter crashes into Scottish pub	Police helicopter crashes on top of bar in Glasgow	4.0
3879	3922	main-news	headlines	2013	212	none	none	Remains of 167 bodies found in Mexican cave	Remains of 167 people found in Mexico cave	5.0
3127	3153	main-news	MSRpar	2012train	302	none	none	Scientists believed Stardust trapped thousands of particles of dust.	Stardust was designed to gather thousands of dust particles streaming from Wild 2.	3.0
5117	5160	main-news	headlines	2015	516	none	none	At least 11 killed in India building collapse	At Least 66 Killed in Bomb Blasts in Iraq	0.6
